Alpine Umwelt,Environnement alpin,NULL,S1460,1300,NULL,NULL,NULL,<p>gute allgemeine Kondition für eine Wintertour in den Bergen mit Schneeschuhen</p>,<p>bonne condition physique générale pour une course d’hiver en raquettes en montagne</p>,NULL,1,2100026,A1300,"HO-0001,HON-KAT-I,KP-ADMIN-KAT I-IV,KP-REISE/MATERIAL,SPÖ-0001",18,0,4,8,4,8,2.00,winter,hut,0,0,NULL,NULL,NULL
Alpine Umwelt,Environnement alpin,NULL,S5760,5600,NULL,NULL,NULL,"<p>Gute allgemeine Kondition für Touren im Hochgebirge, Trittsicherheit. Wir werden grösstenteils auf Wanderwegen bleiben, betreten aber von Zeit zu Zeit für Beobachtungen unwegsames Gelände.</p>","<p>bonne condition physique générale pour des courses de haute montagne, pied sûr. Nous resterons en grande partie sur des sentiers pédestres, mais parcourrons de temps à autre des terrains dépourvus de chemins</p>",NULL,1,2100026,A5600,"HO-0001,HO-0004,HON-KAT-I,KP-ADMIN-KAT I-IV,KP-REISE/MATERIAL,KV-0001,SPD-0001,SPÖ-0001,SPP-0001",18,0,4,8,4,8,2.00,summer,hut,0,0,NULL,NULL,NULL
Alpinwandern,Randonnée alpine,NULL,S5750,5400,NULL,NULL,NULL,"<p>Kondition für bis 5-7-stündige Wanderungen bis Schwierigkeitsgrad T4, Trittsicherheit, kein Schwindelgefühl</p>","<p>condition physique pour des randonnées jusqu’à 5-7 heures, jusqu’au degré de difficulté T4?; pied sûr?; pas de vertige</p>",NULL,2,2100022,A5400,"HO-0001,HO-0004,HON-KAT-I,HON-KAT-I,KP-ADMIN-KAT I-IV,KP-REISE/MATERIAL,KV-0001,SPD-0001,SPÖ-0001,SPP-0001",18,0,5,18,6,7,5.00,summer,pension,0,0,NULL,NULL,"Ski Leiter,Snowboard Leiter"
Alpinwandern,Randonnée alpine,NULL,S6570,6990,NULL,NULL,NULL,<p>aktive/r SAC-Tourenleiter/in Sommer (Unterschrift SAC-Tourenchefin)</p>,<p>activité actuelle de chef/fe de courses du CAS été (signature du préposé aux courses)</p>,NULL,5,2100025,A6500,"HO-0001,HON-KAT-X,KP-ADMIN-KAT I-IV,KP-REISE/MATERIAL,KV-0001,SPÖ-0001",18,0,5,12,6,7,2.00,spring,hut,0,1,NULL,NULL,NULL
Alpinwandern T5,Randonnée alpine T5,NULL,S6560,6500,NULL,NULL,NULL,"<p><strong>Anforderungen:</strong> Tourenleiter/in Alpinwandern oder Sommer 1, Sommer 2; Kondition für bis 8-stündige Wanderungen bis Schwierigkeitsgrad T5+; Leitungserfahrung bis T4; gute Trittsicherheit, kein Schwindelgefühl, Affinität zu technischen Hilfsmitteln, gute Selbsteinschätzung</p>","<p><strong>Exigences:</strong> cchef·fe de courses randonnée alpine ou été 1, été 2; condition physique pour une randonnée de huit heures allant jusqu’à un niveau de difficulté T5+; expérience chef· fe de courses jusqu’au niveau T4; le pied très sûr, pas de vertige, affinité avec les outils techniques, bonne auto-évaluation</p>",NULL,5,2100025,A6500,"HON-KAT-V,HON-KAT-I,KP-ADMIN-KAT I-IV,KP-REISE/MATERIAL",18,0,5,6,6,6,3.00,summer,pension,0,1,NULL,Ski Leiter,NULL
Alpinwandern: Schnupperkurs,Randonnée alpine: cours de découverte,NULL,S5745,5400,NULL,NULL,NULL,"<p>Kondition für bis zu 5-stündige Wanderungen bis <a href=\""https://www.sac-cas.ch/de/ausbildung-und-sicherheit/tourenplanung/schwierigkeitsskalen/\"" target=\""_blank\"">Schwierigkeitsgrad T3</a>, Trittsicherheit, kein Schwindelgefühl</p>","<p>condition physique pour des randonnées jusqu’à 5 heures, jusqu’au <a href=\""https://www.sac-cas.ch/fr/formation-et-securite/planification-de-la-course/echelles-de-difficulte/\"" target=\""_blank\"">degré de difficulté T3</a>?; pied sûr?; pas de vertige</p>",NULL,1,2100022,A5400,"HO-0001,HO-0002,HO-0004,HON-KAT-II,HON-KAT-II,KP-ADMIN-KAT I-IV,KP-REISE/MATERIAL,KV-0001,SPD-0001,SPÖ-0001,SPP-0001",18,0,5,12,6,6,2.00,summer,hut,0,0,NULL,NULL,NULL
Bergsteigen Sommer,Alpinisme été,NULL,S6530,6500,NULL,NULL,NULL,<p>aktive/r SAC-Tourenleiter/in Sommer (Unterschrift SAC-Tourenchef)</p>,<p>activité actuelle de chef/fe de courses du CAS été (signature du préposé aux courses)</p>,NULL,5,2100025,A6500,"HO-0001,HON-KAT-I,KP-ADMIN-KAT I-IV,KP-REISE/MATERIAL,KV-0001,SPÖ-0001,SPP-0001",18,0,5,12,6,7,3.00,summer,hut,0,0,NULL,NULL,NULL
Bergwandern,Randonnée en montagne,NULL,S5740,5300,NULL,NULL,NULL,"<p>Kondition für bis 5-stündige Wanderungen auf weiss-rot-weiss markierten Wegen bis max. Grad T3 nach der <a href=\""t3://page?uid=662\"" target=\""_blank\"">SAC-Berg- und Alpinwanderskala</a>.</p>","<p>bonne condition physique pour randonnées jusqu’à 5 heures sur sentiers balisés blanc-rouge-blanc, jusqu’au degré T3 max. selon <a href=\""t3://page?uid=662\"" target=\""_blank\"">l’échelle CAS pour la randonnée en montagne et alpine</a></p>",NULL,2,2100022,A5300,"HO-0001,HON-KAT-I,HON-KAT-II,KP-ADMIN-KAT I-IV,KP-REISE/MATERIAL,KV-0001,SPD-0001,SPÖ-0001,SPP-0001",18,0,5,16,8,8,5.00,summer,pension,0,1,NULL,NULL,NULL
Biwakieren,NULL,NULL,S5780,5600,NULL,NULL,NULL,,NULL,NULL,2,2100022,A5600,NULL,18,0,5,12,6,7,2.00,summer,bivouac,0,0,NULL,NULL,NULL
